{
  "source_id": "SRC_WS1681458_YAMAZAKI_TEV_MUON",
  "local_file": "references/_local/Yamazaki_TeV_muon_detectors.pdf",
  "committed_copy": null,
  "title": "Challenges of TeV-muon Detectors",
  "authors": "Yuji Yamazaki (affiliation not stated on the title slide; presented online)",
  "venue": "slides, 17 pages; workshop 'Ultra-cold muons for the LHC', AGH Kraków, 24–26 Sept 2026 (CERN Indico event 1681458, contribution 7263331)",
  "identifier": "https://indico.cern.ch/event/1681458/contributions/7263331/",
  "pages": 17,
  "licence": "not stated (workshop slides)",
  "redistribution": "not committed",
  "category": "PRIMARY_LHMUC",
  "upload_name": "8db62c2c-MuonDet_mu_p_2026_yamazaki_v1.pdf",
  "sha256": "6652a09c43e73263f145a59ecf03567c353fe98c637257f88d93761ce2b58e0c",
  "size_bytes": 1770489,
  "archived_on": "2026-10-28",
  "archive_method": "user upload to Claude Code session, copied unmodified; per-page text extracted with pdftotext",
  "read_status": "read in full (all pages) during the addendum planning session, 2026-10-28"
}
